id,title,creator,category,year,topic,note,url
reading-001,The Undercover Economist,Tim Harford,Book,2005,Economics,"An accessible introduction to incentives, prices, markets and the economic choices hidden inside everyday life.",
reading-002,Asian Godfathers,Joe Studwell,Book,2007,Asian business,"A critical account of family-controlled conglomerates, political influence and capital accumulation in Hong Kong and Southeast Asia.",
reading-003,Financial Times,Financial Times,Periodical,2026,Markets and economic policy,"Useful for following UK fiscal policy, gilt markets, companies, trade and global macroeconomic developments.",https://www.ft.com/
reading-004,The Economist,The Economist,Periodical,2026,Economics and international affairs,"Provides concise arguments and comparative coverage of economic policy, business, politics and international relations.",https://www.economist.com/
reading-005,Nikkei Asia,Nikkei,Online,2026,Asian business and politics,"A strong source for contemporary reporting on Asian companies, supply chains, technology, trade and regional policy.",https://asia.nikkei.com/
reading-006,The Wall Street Journal — Asia,The Wall Street Journal,Online,2026,Asian and global markets,"Useful for reporting and analysis on companies, investment, financial markets and economic developments across Asia.",https://www.wsj.com/news/types/asia-news
reading-007,UK Economic Accounts and Labour Market Data,Office for National Statistics,Official source,2026,UK macroeconomics,"Primary statistical material for checking claims about growth, inflation, employment, wages and household conditions.",https://www.ons.gov.uk/economy
reading-008,Monetary Policy Report,Bank of England,Official source,2026,Inflation and interest rates,"A primary source for understanding the Bank’s assessment of inflation, growth, interest rates and risks to the UK economy.",https://www.bankofengland.co.uk/monetary-policy-report